{
  "schema_version": "1.0",
  "issue_id": "SP-2022-Y",
  "run_id": "arxiv-api-SP-2022-Y-20260817T154018Z",
  "stage": "paper-discovery",
  "collector": {
    "id": "arxiv-api",
    "provider": "arXiv",
    "model": null,
    "prompt_id": null,
    "prompt_version": null,
    "prompt_hash": null
  },
  "time": {
    "started_at": null,
    "completed_at": "2026-08-17T15:40:18Z",
    "observed_at": "2026-08-17T15:40:18Z",
    "collection_window_start": "2022-10-01T00:00:00Z",
    "collection_window_end": "2022-10-31T23:59:59Z",
    "editorial_cutoff": "2022-12-31T23:59:59Z"
  },
  "inputs": [
    "config/source-intake.json",
    "weekly plan"
  ],
  "outputs": [
    {
      "path": "sources/SP-2022-Y/collectors/arxiv/runs/20260817T154018Z/raw/cs-ai.atom",
      "sha256": "276c95641df8ad1627384d6d7d5e566efb3b0dff71de10d178dd3a4e3e7094f5",
      "bytes": 3955383
    },
    {
      "path": "sources/SP-2022-Y/collectors/arxiv/runs/20260817T154018Z/raw/cs-cl.atom",
      "sha256": "7812767a55f05fa4f84c0a2f9fedb2bc8b4511b93b072b5c2e4451785f6e36b9",
      "bytes": 3028193
    },
    {
      "path": "sources/SP-2022-Y/collectors/arxiv/runs/20260817T154018Z/raw/cs-lg.atom",
      "sha256": "ef816d4bf8b008602eff3f238ad2fb18f2eeb44995d49a70a2481291b2a4ad66",
      "bytes": 4500057
    },
    {
      "path": "sources/SP-2022-Y/collectors/arxiv/runs/20260817T154018Z/raw/cs-cv.atom",
      "sha256": "3fb01379b76a29a2ae219fef91944f908d4e03f1376e777dee89de8c77418739",
      "bytes": 4526128
    },
    {
      "path": "sources/SP-2022-Y/collectors/arxiv/runs/20260817T154018Z/raw/cs-dc.atom",
      "sha256": "0aa36c47860e259ff19eab96882058f217d3be442d752cc79d036d42310a35bc",
      "bytes": 433103
    },
    {
      "path": "sources/SP-2022-Y/collectors/arxiv/runs/20260817T154018Z/raw/cs-cr.atom",
      "sha256": "0af04fead3f07ded2be3406bb0f5dc8ddde654b497f515b18e457534c566d2ba",
      "bytes": 1006072
    },
    {
      "path": "sources/SP-2022-Y/collectors/arxiv/runs/20260817T154018Z/summary.json",
      "sha256": "df250cc72d80a76ae8a0a6dda8426d064e9ff2de0ac0559d5657de05f482bfa4",
      "bytes": 11638689
    }
  ],
  "tool_access": [
    "HTTPS GET https://export.arxiv.org/api/query"
  ],
  "status": "success",
  "notes": [
    "Raw Atom responses are preserved unchanged; summary.json is collector-derived metadata for later screening.",
    "Transient arXiv HTTP 429/5xx and transport timeout failures use configured conservative retry/backoff before the query is marked failed."
  ]
}
